{
  "schemaVersion": 1,
  "classId": "CLASS_MINH_KIEM",
  "displayNameKey": "CLASS.CLASS_MINH_KIEM.NAME",
  "element": "KIM",
  "role": "MELEE_FLEX",
  "weaponType": "SWORD",
  "startingSkillIds": ["SK-MK-01", "SK-MK-02", "SK-MK-03"],
  "assetKey": "Art/Characters/CLASS_MINH_KIEM",
  "sourceRef": "Content_Bible_Ngu_Mach_Huyen_An_vi.md#Minh-Kiem"
}
